{
  "$schema": "https://packageurl.org/purl-schemas/purl-type-definition.schema-1.1.json",
  "$id": "https://packageurl.org/purl-types/bitbucket-definition.json",
  "type": "bitbucket",
  "type_name": "Bitbucket",
  "description": "Bitbucket-based packages",
  "repository": {
    "use_repository": true,
    "default_repository_url": "https://bitbucket.org"
  },
  "namespace_definition": {
    "requirement": "required",
    "note": "The namespace is the user or organization. It is not case sensitive and shall be lowercased.",
    "native_name": "user or organization",
    "case_sensitive": false
  },
  "name_definition": {
    "requirement": "required",
    "note": "The name is the repository name. It is not case sensitive and shall be lowercased.",
    "native_name": "repository name",
    "case_sensitive": false
  },
  "version_definition": {
    "requirement": "optional",
    "note": "The version is a commit or tag.",
    "native_name": "commit or tag"
  },
  "examples": [
    "pkg:bitbucket/birkenfeld/pygments-main@244fd47e07d1014f0aed9c"
  ]
}
